number,value,datetime_start,datetime_complete,duration,params_activation,params_alpha,params_batch_size,params_learning_rate_init,params_loss_metric,params_n_camadas,params_n_unidades,params_solver,system_attrs_tpe:relative_params:0,state
0,0.508500772797527,2026-10-01 15:19:14.462207,2026-10-01 15:19:30.468941,0 days 00:00:16.006734,logistic,0.001111678711961535,128,0.00024147015398492505,mse,2,10,sgd,,COMPLETE
1,0.5309119010819165,2026-10-01 15:19:30.469068,2026-10-01 15:19:31.525757,0 days 00:00:01.056689,logistic,0.003801413894212388,128,0.010134459862661318,cross_entropy,1,10,sgd,,COMPLETE
2,0.517774343122102,2026-10-01 15:19:31.525958,2026-10-01 15:19:33.068663,0 days 00:00:01.542705,logistic,0.0016000141504822487,32,0.03592536001966131,cross_entropy,2,20,adam,,COMPLETE
3,0.536321483771252,2026-10-01 15:19:33.068806,2026-10-01 15:19:37.774664,0 days 00:00:04.705858,logistic,2.7588697691456747e-06,32,0.03181906513910267,cross_entropy,2,40,sgd,,COMPLETE
4,0.5370942812983,2026-10-01 15:19:37.774795,2026-10-01 15:20:06.249557,0 days 00:00:28.474762,tanh,0.007159781735243506,128,0.00014662922341512335,mse,2,10,sgd,,COMPLETE
5,0.5363214837712519,2026-10-01 15:20:06.249694,2026-10-01 15:20:28.964099,0 days 00:00:22.714405,logistic,0.02187689471257419,128,0.000342424869898095,mse,1,40,sgd,,COMPLETE
6,0.5324574961360125,2026-10-01 15:20:28.964269,2026-10-01 15:20:30.709242,0 days 00:00:01.744973,tanh,3.865063398178925e-06,32,0.0019899711663091415,cross_entropy,1,20,sgd,,COMPLETE
7,0.5340030911901081,2026-10-01 15:20:30.709373,2026-10-01 15:20:35.166971,0 days 00:00:04.457598,logistic,5.9463824683102816e-05,128,0.00025301844178100255,mse,2,20,adam,,COMPLETE
8,0.535548686244204,2026-10-01 15:20:35.167128,2026-10-01 15:20:36.208811,0 days 00:00:01.041683,relu,0.008839035655424963,128,0.096212516795131,cross_entropy,1,40,adam,,COMPLETE
9,0.5401854714064915,2026-10-01 15:20:36.209195,2026-10-01 15:20:37.911080,0 days 00:00:01.701885,tanh,1.435122655945028e-06,64,0.09109113517142314,mse,2,40,adam,,COMPLETE
10,0.5193199381761979,2026-10-01 15:20:37.911220,2026-10-01 15:20:39.598259,0 days 00:00:01.687039,tanh,1.3976190516096163e-05,64,0.008720917048381469,mse,2,40,adam,"{""activation"": ""tanh"", ""alpha"": 1.3976190516096163e-05, ""batch_size"": 64, ""learning_rate_init"": 0.008720917048381469, ""loss_metric"": ""mse"", ""n_camadas"": 2, ""n_unidades"": 40, ""solver"": ""adam""}",COMPLETE
11,0.5309119010819165,2026-10-01 15:20:39.598438,2026-10-01 15:20:40.831659,0 days 00:00:01.233221,tanh,0.0011767931731936085,128,0.02383561874626222,mse,2,10,sgd,"{""activation"": ""tanh"", ""alpha"": 0.0011767931731936085, ""batch_size"": 128, ""learning_rate_init"": 0.02383561874626222, ""loss_metric"": ""mse"", ""n_camadas"": 2, ""n_unidades"": 10, ""solver"": ""sgd""}",COMPLETE
12,0.5370942812982998,2026-10-01 15:20:40.832147,2026-10-01 15:20:45.468789,0 days 00:00:04.636642,tanh,0.012432501360024975,64,0.0009123531704698869,mse,2,10,sgd,"{""activation"": ""tanh"", ""alpha"": 0.012432501360024975, ""batch_size"": 64, ""learning_rate_init"": 0.0009123531704698869, ""loss_metric"": ""mse"", ""n_camadas"": 2, ""n_unidades"": 10, ""solver"": ""sgd""}",COMPLETE
13,0.5216383307573416,2026-10-01 15:20:45.468985,2026-10-01 15:20:45.878974,0 days 00:00:00.409989,tanh,0.05190190022640216,128,0.008467458482620503,mse,2,10,adam,"{""activation"": ""tanh"", ""alpha"": 0.05190190022640216, ""batch_size"": 128, ""learning_rate_init"": 0.008467458482620503, ""loss_metric"": ""mse"", ""n_camadas"": 2, ""n_unidades"": 10, ""solver"": ""adam""}",COMPLETE
14,0.5363214837712519,2026-10-01 15:20:45.879249,2026-10-01 15:20:51.606445,0 days 00:00:05.727196,tanh,2.6794582263815892e-05,128,0.0011741643601661594,mse,2,10,sgd,"{""activation"": ""tanh"", ""alpha"": 2.6794582263815892e-05, ""batch_size"": 128, ""learning_rate_init"": 0.0011741643601661594, ""loss_metric"": ""mse"", ""n_camadas"": 2, ""n_unidades"": 10, ""solver"": ""sgd""}",COMPLETE
15,0.5316846986089645,2026-10-01 15:20:51.606575,2026-10-01 15:20:52.089765,0 days 00:00:00.483190,tanh,3.167732185465524e-05,128,0.06421448823934992,mse,2,10,sgd,"{""activation"": ""tanh"", ""alpha"": 3.167732185465524e-05, ""batch_size"": 128, ""learning_rate_init"": 0.06421448823934992, ""loss_metric"": ""mse"", ""n_camadas"": 2, ""n_unidades"": 10, ""solver"": ""sgd""}",COMPLETE
16,0.5494590417310664,2026-10-01 15:20:52.089876,2026-10-01 15:20:53.430615,0 days 00:00:01.340739,tanh,0.0002529272200120408,64,0.07957683885143534,mse,2,40,adam,"{""activation"": ""tanh"", ""alpha"": 0.0002529272200120408, ""batch_size"": 64, ""learning_rate_init"": 0.07957683885143534, ""loss_metric"": ""mse"", ""n_camadas"": 2, ""n_unidades"": 40, ""solver"": ""adam""}",COMPLETE
17,0.5216383307573416,2026-10-01 15:20:53.430710,2026-10-01 15:20:54.970694,0 days 00:00:01.539984,tanh,5.757793275968701e-06,64,0.09167108738992476,mse,2,40,adam,"{""activation"": ""tanh"", ""alpha"": 5.757793275968701e-06, ""batch_size"": 64, ""learning_rate_init"": 0.09167108738992476, ""loss_metric"": ""mse"", ""n_camadas"": 2, ""n_unidades"": 40, ""solver"": ""adam""}",COMPLETE
18,0.5146831530139104,2026-10-01 15:20:54.970868,2026-10-01 15:20:59.149461,0 days 00:00:04.178593,tanh,0.00043041728275451,64,0.03354616345501954,cross_entropy,2,40,adam,"{""activation"": ""tanh"", ""alpha"": 0.00043041728275451, ""batch_size"": 64, ""learning_rate_init"": 0.03354616345501954, ""loss_metric"": ""cross_entropy"", ""n_camadas"": 2, ""n_unidades"": 40, ""solver"": ""adam""}",COMPLETE
19,0.5293663060278206,2026-10-01 15:20:59.149640,2026-10-01 15:21:01.546647,0 days 00:00:02.397007,logistic,0.0025783260005883602,64,0.044332900812190795,mse,2,40,adam,"{""activation"": ""logistic"", ""alpha"": 0.0025783260005883602, ""batch_size"": 64, ""learning_rate_init"": 0.044332900812190795, ""loss_metric"": ""mse"", ""n_camadas"": 2, ""n_unidades"": 40, ""solver"": ""adam""}",COMPLETE
